High_Requirements,Low_Requirements,Instruction
Show Critical Path; The critical path indicates which tasks will cause project delays if they are delayed.,GUI needs to provide ability to display critical path and make the changes affecting critical path updated.,"Definition: In this task, design a GUI feature that displays the critical path and updates it automatically when changes affect it.
Emphasis & Caution: Ensure real-time updates after any relevant change.
Things to Avoid: Do not require manual refresh."
"Add/Remove Task links; Tasks can be linked with one another to indicate the sequence in which they have to be performed. For example, if there is a link from task 1 to task 2 then task 2 can only be started after task 1 is completed. The start date of task 2 must thus be after the end date of task 1.",GUI needs to provide ability to show utilization of a person.,"Definition: In this task, design a GUI feature that shows the utilization of a person.
Emphasis & Caution: Display utilization clearly and accurately.
Things to Avoid: Do not show outdated or aggregated data incorrectly."
Change Task Begin/End Times manually with user changes; Change the start or end date either by editing its properties or by dragging-and-dropping the bar in the GUI.,"The human resource class contains name, phone, email, and holidays. The class provides functions to set and get these properties. A class is used to represent the holidays. There can be multiple holidays. ","Definition: In this task, define a human resource class with name, phone, email, and multiple holidays, including setter and getter functions.
Emphasis & Caution: Holidays must be represented by a separate class and support multiple entries.
Things to Avoid: Do not merge holiday data into primitive fields."
Add/Remove Resources to Tasks Dependencies;Dependencies between tasks and resources indicate the resources who are supposed to complete a task. Each task could be worked on by multiple persons and each person could work on multiple tasks. Dependencies may also be annotated to capture how many hours each person is supposed to work on a task on a daily basis.,The manager of task hierarchy provides a method to move a task node to a specific position.,"Definition: In this task, implement a method in the task hierarchy manager to move a task node to a specific position.
Emphasis & Caution: Preserve task hierarchy integrity after moving.
Things to Avoid: Do not break parent-child relationships."
Change Task Begin/End Times automatically with dependency changes;The start or end date should be changed automatically if links among tasks are changed,The human resource class can have multiple objects of resource assignments which assigns this resource to tasks. The class provides function to get the list of these objects.,"Definition: In this task, implement a human resource class that manages multiple resource assignment objects and returns their list.
Emphasis & Caution: Ensure all assignments are retrievable.
Things to Avoid: Do not return partial or copied lists."
Add/Remove Holidays and Vacation Days;Holidays and vacation days are properties of persons (resources). changing this information also changes the availability of a person on certain days.,A GUI class of graphic area provides function to draw dependency. The function uses an object of task manager to add dependencies.,"Definition: In this task, implement a GUI graphic area function to draw dependencies using a task manager object.
Emphasis & Caution: Dependency creation must be handled through the task manager.
Things to Avoid: Do not create dependencies directly without the manager."
Prevent Circular Dependencies;Links among tasks may not be circular in that task 1 cannot depend on task 2 if task 2 already depends on task 1.,A GUI class uses an object of resource tree table model class to display the resource tree. The resource tree table model provides functions build subtrees based on dependencies.,"Definition: In this task, use a resource tree table model object in a GUI class to display a resource tree built from dependencies.
Emphasis & Caution: Subtrees must be built based on dependencies.
Things to Avoid: Do not display a static or flat tree."
Change Task Begin/End Times manually with user changes; Change the start or end date either by editing its properties or by dragging-and-dropping the bar in the GUI.,A GUI of task property provides interface and functions to add and remove human resource assignments by using an object of the resource assignments collection class.,"Definition: In this task, implement a task property GUI that adds and removes human resource assignments using a resource assignments collection object.
Emphasis & Caution: Operations must use the collection object interface.
Things to Avoid: Do not modify assignments directly."
Change Task Begin/End Times automatically with dependency changes;The start or end date should be changed automatically if links among tasks are changed,An object of the recalculating task schedule algorithm class is used to change the start or end date based on dependency changes. The algorithm class provides functions to fulfill the constraints and to modify the start or end date of the tasks.,"Definition: In this task, use a task schedule recalculation algorithm object to update task start or end dates after dependency changes.
Emphasis & Caution: All constraints must be fulfilled before applying date changes.
Things to Avoid: Do not bypass the algorithm logic."
"Show Resource Utilization (underused or overused person);Tasks may be assigned to persons and it should be indicated if a person receives more tasks than he/she is able to handle (e.g., the person hours per  task for all tasks exceeds the allowed 8 hours a day) or if the person is not available due to holidays or vacation days. it should also be indicated if the person is under-utilized in that he/she is working less than the 8 hours a day.",The human resource class provides a function to change the availability of the person based on holidays. ,"Definition: In this task, implement a function in the human resource class to change availability based on holidays.
Emphasis & Caution: Availability must reflect all defined holidays.
Things to Avoid: Do not ignore existing holiday data."
Create Resources (person);GanttProject supports Persons as resources. Persons have names and holidays or vacation days. Persons can be assigned to work on tasks.,GUI needs to provide ability to assign persons to tasks.,"Definition: In this task, implement a GUI feature that assigns persons to tasks.
Emphasis & Caution: Ensure assignments are correctly linked to tasks.
Things to Avoid: Do not allow duplicate assignments."
"Add/Remove Task links; Tasks can be linked with one another to indicate the sequence in which they have to be performed. For example, if there is a link from task 1 to task 2 then task 2 can only be started after task 1 is completed. The start date of task 2 must thus be after the end date of task 1.",The class of dependency collection provides a function to check if the new dependency will cause a loop each time a object of dependency class is created. The function returns an exception if there is a loop. ,"Definition: In this task, implement a dependency collection function that checks for loops when creating a new dependency and throws an exception if detected.
Emphasis & Caution: Loop detection must occur at creation time.
Things to Avoid: Do not allow cyclic dependencies."
Create Resources (person);GanttProject supports Persons as resources. Persons have names and holidays or vacation days. Persons can be assigned to work on tasks.,Application needs to keep track of task's begin and end times.,"Definition: In this task, implement application logic to track each taskˇŻs begin and end times.
Emphasis & Caution: Times must stay consistent after updates.
Things to Avoid: Do not lose or overwrite time data incorrectly."
Create Resources (person);GanttProject supports Persons as resources. Persons have names and holidays or vacation days. Persons can be assigned to work on tasks.,GUI needs to provide ability to show is a person is  underutilized and overbooked.,"Definition: In this task, design a GUI feature that shows whether a person is underutilized or overbooked.
Emphasis & Caution: Status must reflect current assignments.
Things to Avoid: Do not display outdated utilization status."
Delete Tasks; Delete an existing task and all its associated information such as links to other tasks or knowledge on what resources are supposed to work on them.,When deleting a task the GanttProject class calls GanttTreeTableNode and DefaultMutableTreeNode classes to identify the parent of the task being deleted.,"Definition: In this task, implement task deletion logic that identifies the taskˇŻs parent using GanttTreeTableNode and DefaultMutableTreeNode.
Emphasis & Caution: Parent identification must be accurate.
Things to Avoid: Do not delete tasks without resolving hierarchy."
"Add/Remove Tasks as Subtasks;A task can be made a subtask of another. For example, task 1.1 is a subtask of task 1.",GUI should able to provide ability to set progress on a task.,"Definition: In this task, implement a GUI feature that allows setting task progress.
Emphasis & Caution: Progress values must be valid.
Things to Avoid: Do not accept out-of-range progress values."
Add/Remove Holidays and Vacation Days;Holidays and vacation days are properties of persons (resources). changing this information also changes the availability of a person on certain days.,An assignment of a resource to a task is captured as a relationship.,"Definition: In this task, model the assignment of a resource to a task as a relationship.
Emphasis & Caution: Relationship must clearly link resource and task.
Things to Avoid: Do not store assignments as loose attributes."
Add/Remove Holidays and Vacation Days;Holidays and vacation days are properties of persons (resources). changing this information also changes the availability of a person on certain days.,The human resource class contains the variable holidays. The class provides functions to change and to get holidays. There can be multiple holidays. ,"Definition: In this task, implement holiday management in the human resource class with functions to set and get multiple holidays.
Emphasis & Caution: Support multiple holiday entries.
Things to Avoid: Do not overwrite existing holidays unintentionally."
Prevent Circular Dependencies;Links among tasks may not be circular in that task 1 cannot depend on task 2 if task 2 already depends on task 1.,A GUI class of graphic area provides a function to draw dependency. The function uses an object of the task manager to add dependencies.1,"Definition: In this task, implement a GUI graphic area function to draw dependencies using a task manager object.
Emphasis & Caution: Dependencies must be added through the task manager.
Things to Avoid: Do not bypass the task manager."
Change Task Begin/End Times automatically with dependency changes;The start or end date should be changed automatically if links among tasks are changed,A GUI class of task property provides interface and functions to add and remove dependencies by using an object of the dependency collection.,"Definition: In this task, implement a task property GUI that adds and removes dependencies using a dependency collection object.
Emphasis & Caution: All dependency changes must go through the collection.
Things to Avoid: Do not modify dependencies directly."
Create a new task which typically has a  start date and an end date. Tasks are activities that one or more persons resources are expected to complete in the specified time frame.,The Task class provides a public method SetEnd() which allows to specify starting date for the task. As input argument the method takes an object of GanttCalendar class.,"Definition: In this task, implement a public SetEnd() method in the Task class that sets the task start date using a GanttCalendar object.
Emphasis & Caution: The input must be a GanttCalendar object.
Things to Avoid: Do not accept primitive date types."
Create Resources (person);GanttProject supports Persons as resources. Persons have names and holidays or vacation days. Persons can be assigned to work on tasks.,The Task class provides a public method SetEnd() which allows to specify starting date for the task. As input argument the method takes an object of GanttCalendar class.,"Definition: In this task, implement a public SetEnd() method in the Task class that sets the task start date using a GanttCalendar object.
Emphasis & Caution: Ensure the method is publicly accessible.
Things to Avoid: Do not change the method signature."
Change Task Begin/End Times automatically with dependency changes; The start or end date should be changed automatically if one of its subtasks changes.,GUI needs to provide ability to link tasks in a project.,"Definition: In this task, implement a GUI feature that links tasks within a project.
Emphasis & Caution: Links must reflect valid task relationships.
Things to Avoid: Do not create invalid or circular links."
Create Resources (person);GanttProject supports Persons as resources. Persons have names and holidays or vacation days. Persons can be assigned to work on tasks.,A class is used to represent the dependency between one task and one human resource. The dependency class provides functions to get the task and the human resource. ,"Definition: In this task, implement a dependency class representing the relationship between one task and one human resource, with getter functions.
Emphasis & Caution: Provide getters for both task and human resource.
Things to Avoid: Do not expose internal fields directly."
"Maintain task properties;  Edit and update task properties including start and end date, name, or progress(% complete).",A human resource assignment class is used to represent the relationship between one task and one human resource. The class provides functions to get the task and the human resource. ,"Definition: In this task, implement a human resource assignment class representing the relationship between one task and one human resource, with getter functions.
Emphasis & Caution: Ensure a one-to-one task¨Cresource relationship.
Things to Avoid: Do not mix multiple tasks or resources in one assignment."
"Show Resource Utilization (underused or overused person);Tasks may be assigned to persons and it should be indicated if a person receives more tasks than he/she is able to handle (e.g., the person hours per  task for all tasks exceeds the allowed 8 hours a day) or if the person is not available due to holidays or vacation days. it should also be indicated if the person is under-utilized in that he/she is working less than the 8 hours a day.",GUI needs to provide ability to show utilization of a person.,"Definition: In this task, implement a GUI feature that shows the utilization of a person.
Emphasis & Caution: Utilization must reflect current assignments.
Things to Avoid: Do not display stale data."
"Show Resource Utilization (underused or overused person);Tasks may be assigned to persons and it should be indicated if a person receives more tasks than he/she is able to handle (e.g., the person hours per  task for all tasks exceeds the allowed 8 hours a day) or if the person is not available due to holidays or vacation days. it should also be indicated if the person is under-utilized in that he/she is working less than the 8 hours a day.",GUI needs to provide ability to delete resources from a project.,"Definition: In this task, implement a GUI feature that deletes resources from a project.
Emphasis & Caution: Ensure related assignments are handled correctly.
Things to Avoid: Do not leave orphaned references."
Prevent Circular Dependencies;Links among tasks may not be circular in that task 1 cannot depend on task 2 if task 2 already depends on task 1.,The class of dependency collection provides a function to check if the new dependency will cause a loop each time a object of dependency class is created. The function returns an exception if there is a loop. ,"Definition: In this task, implement a dependency collection function that checks for loops when creating a dependency and throws an exception if found.
Emphasis & Caution: Loop checking must occur at creation time.
Things to Avoid: Do not allow cyclic dependencies."
"Add/Remove Tasks as Subtasks;A task can be made a subtask of another. For example, task 1.1 is a subtask of task 1.",GUI needs to provide ability to display critical path and make the changes affecting critical path updated.,"Definition: In this task, implement a GUI feature that displays the critical path and updates it when changes affect it.
Emphasis & Caution: Updates must be automatic.
Things to Avoid: Do not require manual refresh."
"Maintain Resource Properties;A resource has a range of properties, including name and holidays",A class is used to represent the dependency between one task and one human resource. The dependency class provides functions to get the task and the human resource. ,"Definition: In this task, implement a dependency class representing the relationship between one task and one human resource, with getter functions.
Emphasis & Caution: Return correct task and human resource objects.
Things to Avoid: Do not return null or unrelated objects."
Add/Remove Resources to Tasks Dependencies;Dependencies between tasks and resources indicate the resources who are supposed to complete a task. Each task could be worked on by multiple persons and each person could work on multiple tasks. Dependencies may also be annotated to capture how many hours each person is supposed to work on a task on a daily basis.,The human resource class can have multiple objects of resource assignments which assigns this resource to tasks. The class provides function to get the list of these objects.,"Definition: In this task, implement a human resource class that holds multiple resource assignment objects and returns their list.
Emphasis & Caution: Ensure all assignments for the resource are included.
Things to Avoid: Do not return incomplete or copied lists."
Add/Remove Holidays and Vacation Days;Holidays and vacation days are properties of persons (resources). changing this information also changes the availability of a person on certain days.,"The human resource class contains name, phone, email, and holidays. The class provides functions to set and get these properties. A class is used to represent the holidays. There can be multiple holidays. ","Definition: In this task, implement a human resource class with name, phone, email, and multiple holidays, using a separate holiday class with setters and getters.
Emphasis & Caution: Support multiple holiday entries via the holiday class.
Things to Avoid: Do not store holidays as primitive fields."
"Maintain task properties;  Edit and update task properties including start and end date, name, or progress(% complete).","To delete a task from the Calendar the GanttProject class call delete method and supplied TaskId paramenter. The adjustment of allocated resources and links to other tasks takes place through interfacing with the following classes DefaultMutableTreeNode, GanttTreeTableNode, TaskNode, and AdjustTaskBoundsAlgorithm.","Definition: In this task, implement task deletion from the calendar by calling the delete method with TaskId and adjusting resources and links via specified classes.
Emphasis & Caution: Use all listed classes to adjust bounds, resources, and links.
Things to Avoid: Do not skip resource or dependency adjustments."
"Add/Remove Task links; Tasks can be linked with one another to indicate the sequence in which they have to be performed. For example, if there is a link from task 1 to task 2 then task 2 can only be started after task 1 is completed. The start date of task 2 must thus be after the end date of task 1.",GUI needs to provide ability to link tasks in a project.,"Definition: In this task, implement a GUI feature that links tasks within a project.
Emphasis & Caution: Links must represent valid task relationships.
Things to Avoid: Do not create circular or invalid links."
Add/Remove Holidays and Vacation Days;Holidays and vacation days are properties of persons (resources). changing this information also changes the availability of a person on certain days.,The Task class provides a public method SetStart() which allows to specify starting date for the task. As input argument the method takes an object of GanttCalendar class. ,"Definition: In this task, implement a public SetStart() method in the Task class that sets the task start date using a GanttCalendar object.
Emphasis & Caution: Accept only a GanttCalendar object as input.
Things to Avoid: Do not change the method signature."
Add/Remove Resources to Tasks Dependencies;Dependencies between tasks and resources indicate the resources who are supposed to complete a task. Each task could be worked on by multiple persons and each person could work on multiple tasks. Dependencies may also be annotated to capture how many hours each person is supposed to work on a task on a daily basis.,GUI needs to provide ability to show is a person is  underutilized and overbooked.,"Definition: In this task, implement a GUI feature that shows whether a person is underutilized or overbooked.
Emphasis & Caution: Status must reflect current workload.
Things to Avoid: Do not show outdated utilization status."
Change Task Begin/End Times manually with user changes; Change the start or end date either by editing its properties or by dragging-and-dropping the bar in the GUI.,When deleting a task the GanttProject class calls GanttTreeTableNode and DefaultMutableTreeNode classes to identify the parent of the task being deleted.,"Definition: In this task, identify a taskˇŻs parent during deletion using GanttTreeTableNode and DefaultMutableTreeNode.
Emphasis & Caution: Parent detection must be accurate.
Things to Avoid: Do not delete tasks without resolving hierarchy."
Delete Resources (person); Delete a person and all its associated information such as dependencies to all tasks the person is supposed to work on.,GUI should able to provide ability to set progress on a task.,"Definition: In this task, implement a GUI feature that allows setting task progress.
Emphasis & Caution: Progress values must be within valid bounds.
Things to Avoid: Do not accept invalid progress values."
Create Resources (person);GanttProject supports Persons as resources. Persons have names and holidays or vacation days. Persons can be assigned to work on tasks.,"When a resource is removed, all the tasks where the resource is assigned need to be updated. ","Definition: In this task, update all tasks assigned to a resource when that resource is removed.
Emphasis & Caution: All affected tasks must be updated.
Things to Avoid: Do not leave orphaned assignments."
Create Resources (person);GanttProject supports Persons as resources. Persons have names and holidays or vacation days. Persons can be assigned to work on tasks.,The start and end dates for the graph can be either flexible or rigid for the purpose of adjusting and fixing potential collisions. ,"Definition: In this task, handle graph start and end dates as flexible or rigid to adjust and resolve collisions.
Emphasis & Caution: Respect the selected flexibility mode.
Things to Avoid: Do not ignore collision constraints."
Create a new task which typically has a  start date and an end date. Tasks are activities that one or more persons resources are expected to complete in the specified time frame.,The system should be able to evaluate critical path in a project.,"Definition: In this task, implement system logic to evaluate the critical path of a project.
Emphasis & Caution: Ensure calculation reflects current task dependencies.
Things to Avoid: Do not use outdated project data."
"Add/Remove Task links; Tasks can be linked with one another to indicate the sequence in which they have to be performed. For example, if there is a link from task 1 to task 2 then task 2 can only be started after task 1 is completed. The start date of task 2 must thus be after the end date of task 1.",The Task class provides a public method SetStart() which allows to specify starting date for the task. As input argument the method takes an object of GanttCalendar class. ,"Definition: In this task, implement a public SetStart() method in the Task class that sets the task start date using a GanttCalendar object.
Emphasis & Caution: Accept only a GanttCalendar object as input.
Things to Avoid: Do not alter the method signature."
Create a new task which typically has a  start date and an end date. Tasks are activities that one or more persons resources are expected to complete in the specified time frame.,A GUI class of task property provides interface and functions to add and remove dependencies by using an object of the dependency collection.,"Definition: In this task, implement a task property GUI that adds and removes dependencies using a dependency collection object.
Emphasis & Caution: All changes must go through the collection interface.
Things to Avoid: Do not modify dependencies directly."
